Physician_Profile_ID,Category,Applicable_Manufacturer_or_Applicable_GPO_Making_Payment_Name,Applicable_Manufacturer_or_Applicable_GPO_Making_Payment_State,Applicable_Manufacturer_or_Applicable_GPO_Making_Payment_ID,Total_Amount_of_Payment_USDollars,Date_of_Payment,Category,Record_ID
312594,GNRL,"BIomet 3i, LLC",FL,100000005638,246.00,10/23/2013,GNRL,110062302
312594,GNRL,"DASH MEDICAL GLOVES INC",WI,100000000242,100.00,02/12/2015,GNRL,233768190
312594,GNRL,"Zimmer Biomet Holdings, Inc.",IN,100000000103,65.51,11/13/2015,GNRL,301104462
312594,GNRL,"Zimmer Biomet Holdings, Inc.",IN,100000000103,44.86,09/16/2015,GNRL,301003108
312594,GNRL,"DASH Medical Gloves Inc",WI,100000000242,30.00,12/11/2013,GNRL,100185554
312594,GNRL,"National Dentex Corporation",FL,100000000065,21.15,12/01/2013,GNRL,105325526
312594,GNRL,"DASH MEDICAL GLOVES INC",WI,100000000242,20.00,04/30/2014,GNRL,159570822
