Physician_Profile_ID,Applicable_Manufacturer_or_Applicable_GPO_Making_Payment_Name,Applicable_Manufacturer_or_Applicable_GPO_Making_Payment_State,Applicable_Manufacturer_or_Applicable_GPO_Making_Payment_ID,Total_Amount_of_Payment_USDollars,Date_of_Payment,Form_of_Payment_or_Transfer_of_Value,Record_ID,Nature_of_Payment_or_Transfer_of_Value,Name_of_Third_Party_Entity_Receiving_Payment_or_Transfer_of_Value,Name_of_Associated_Covered_Drug_or_Biological1,Name_of_Associated_Covered_Drug_or_Biological2,Contextual_Information
616901,"Henry Schein, Inc.",NY,100000005547,404.13,02/06/2014,"In-kind items and services",178586340,Gift,"","","",""
616901,"Zimmer Biomet Holdings, Inc.",IN,100000000103,128.50,10/10/2015,"In-kind items and services",301411958,"Travel and Lodging","","","",""
616901,"Zimmer Biomet Holdings, Inc.",IN,100000000103,126.50,10/10/2015,"In-kind items and services",301411977,"Travel and Lodging","","","",""
616901,"Zimmer Biomet Holdings, Inc.",IN,100000000103,28.59,05/18/2015,"In-kind items and services",301271426,"Food and Beverage","","","",""
616901,"DASH MEDICAL GLOVES INC",WI,100000000242,10.00,06/02/2014,"Cash or cash equivalent",159565967,Gift,"MATTHEW J MAGGIO DDS","Examination Gloves","","Gift Cards"
