Physician_Profile_ID,Applicable_Manufacturer_or_Applicable_GPO_Making_Payment_Name,Applicable_Manufacturer_or_Applicable_GPO_Making_Payment_State,Applicable_Manufacturer_or_Applicable_GPO_Making_Payment_ID,Total_Amount_of_Payment_USDollars,Date_of_Payment,Form_of_Payment_or_Transfer_of_Value,Record_ID,Nature_of_Payment_or_Transfer_of_Value,Name_of_Third_Party_Entity_Receiving_Payment_or_Transfer_of_Value,Name_of_Associated_Covered_Drug_or_Biological1,Name_of_Associated_Covered_Drug_or_Biological2,Contextual_Information
1193906,"Trilliant Surgical Ltd.",TX,100000010369,600.00,07/18/2014,"Cash or cash equivalent",136498984,"Consulting Fee","","","",""
1193906,"Smith & Nephew, Inc.",TN,100000005456,140.12,10/01/2014,"In-kind items and services",182901451,"Food and Beverage","","","",""
1193906,"Trilliant Surgical Ltd.",TX,100000010369,85.00,09/30/2015,"Cash or cash equivalent",293832460,"Food and Beverage","","","",""
1193906,"Zimmer Biomet Holdings, Inc.",IN,100000000103,34.13,04/07/2015,"In-kind items and services",300934188,"Food and Beverage","","","",""
1193906,"Smith & Nephew, Inc.",TN,100000005456,13.74,09/15/2014,"In-kind items and services",182872696,"Food and Beverage","","","",""
1193906,"Shire North American Group Inc",MA,100000061292,11.96,01/15/2014,"In-kind items and services",136352424,"Food and Beverage","","","",""
