Physician_Profile_ID,Applicable_Manufacturer_or_Applicable_GPO_Making_Payment_Name,Applicable_Manufacturer_or_Applicable_GPO_Making_Payment_State,Applicable_Manufacturer_or_Applicable_GPO_Making_Payment_ID,Total_Amount_of_Payment_USDollars,Date_of_Payment,Form_of_Payment_or_Transfer_of_Value,Record_ID,Nature_of_Payment_or_Transfer_of_Value,Name_of_Third_Party_Entity_Receiving_Payment_or_Transfer_of_Value,Name_of_Associated_Covered_Drug_or_Biological1,Name_of_Associated_Covered_Drug_or_Biological2,Contextual_Information
681491,"Medtronic Vascular, Inc.",MN,100000010384,261.07,07/23/2015,"In-kind items and services",296905380,"Food and Beverage","","","",""
681491,"Medtronic Vascular, Inc.",MN,100000010384,168.14,12/03/2015,"In-kind items and services",296905382,"Food and Beverage","","","",""
681491,"CeloNova BioSciences, Inc.",TX,100000010417,94.01,05/08/2014,"Cash or cash equivalent",219421308,"Food and Beverage","","","",""
681491,"Siemens Medical Solutions USA, Inc.",PA,100000010755,91.17,11/30/2015,"In-kind items and services",254159092,"Food and Beverage","","","",""
681491,"Bard Peripheral Vascular, Inc.",AZ,100000005481,18.39,04/27/2015,"Cash or cash equivalent",317647126,"Food and Beverage","","","",""
